id,name,url,ups,downs,created_utc,title,permalink,subreddit,num_comments,author,author_link_karma,author_comment_karma,author_created_utc
4ue150,t3_4ue150,http://imgur.com/nOPb3UP,4333,0,1469380819,Found these weird (grave?)stones almost completely buried under moss and grass in the park near my house.,https://www.reddit.com/r/creepy/comments/4ue150/found_these_weird_gravestones_almost_completely/,creepy,415,Tch0cky,3278,34,1450403929
34tgq7,t3_34tgq7,http://i.imgur.com/IaM0KwT.jpg,4327,0,1430743406,"An ominous figure sitting near the cliff-side at Lake Como, Italy [OC].",https://www.reddit.com/r/creepy/comments/34tgq7/an_ominous_figure_sitting_near_the_cliffside_at/,creepy,228,bmastertempt,3675,130,1334533424
4lc595,t3_4lc595,http://imgur.com/7qqPnHP,4321,0,1464374052,This creepy statue at a local machine shop.,https://www.reddit.com/r/creepy/comments/4lc595/this_creepy_statue_at_a_local_machine_shop/,creepy,222,TrashManX,3487,12,1456725322
40s206,t3_40s206,http://imgur.com/a/Mn2mw,4315,0,1452692465,Mum knits a life size son in placement of her real one,https://www.reddit.com/r/creepy/comments/40s206/mum_knits_a_life_size_son_in_placement_of_her/,creepy,705,rm0234,8878,9797,1408695029
37n07j,t3_37n07j,http://imgur.com/rUHofLK,4297,0,1432845857,Awesome and slightly creepy sand head,https://www.reddit.com/r/creepy/comments/37n07j/awesome_and_slightly_creepy_sand_head/,creepy,284,spider_cereal,106199,4338,1337262102
2vvjop,t3_2vvjop,http://i.imgur.com/OCJ1HnW.jpg,4282,0,1423926018,Footprints in an abandoned nuclear reactor,https://www.reddit.com/r/creepy/comments/2vvjop/footprints_in_an_abandoned_nuclear_reactor/,creepy,439,13x37,53647,4240,1382545844
3ng3t2,t3_3ng3t2,https://i.imgur.com/zOOk8Gm.jpg,4280,0,1443962475,"Dden (""Death"") by Janis Rozents. 1897 Rarely see Death depicted in white and it\'s spooky",https://www.reddit.com/r/creepy/comments/3ng3t2/d\xf6den_death_by_janis_rozent\u0101ls_1897_rarely_see/,creepy,226,N/A,0,0,0
351ogx,t3_351ogx,http://imgur.com/a/75kmu,4271,0,1430910332,"A Cold War Era bunker, built 26 feet underground and equipped to support a family for a year in the event of a nuclear missile strike.",https://www.reddit.com/r/creepy/comments/351ogx/a_cold_war_era_bunker_built_26_feet_underground/,creepy,1061,Vmoney1337,1323694,300075,1325121270
399dmo,t3_399dmo,http://imgur.com/dUnmTd9,4268,0,1433912527,Abandoned Russian mine (x-post /r/interestingasfuck),https://www.reddit.com/r/creepy/comments/399dmo/abandoned_russian_mine_xpost_rinterestingasfuck/,creepy,343,Missa_doodikins,9226,41376,1412997701
2rr4g8,t3_2rr4g8,http://i.imgur.com/noEpc2T.jpg,4252,0,1420733288,Abandoned chapel in a foggy cemetery.,https://www.reddit.com/r/creepy/comments/2rr4g8/abandoned_chapel_in_a_foggy_cemetery/,creepy,297,ethan_kahn,2397426,70380,1328043893
4gqlo4,t3_4gqlo4,http://40.media.tumblr.com/d34902a6eb229ee9e18ebe428633ad47/tumblr_npnzhgj7UL1qgktofo1_1280.jpg,4248,0,1461790917,Go no farther [x-post from /thedepthsbelow],https://www.reddit.com/r/creepy/comments/4gqlo4/go_no_farther_xpost_from_thedepthsbelow/,creepy,775,Paddy32,57628,42447,1402479256
41qfl3,t3_41qfl3,http://imgur.com/K6Y7W4H,4243,0,1453233651,It was a joy for someone,https://www.reddit.com/r/creepy/comments/41qfl3/it_was_a_joy_for_someone/,creepy,288,_Devils_,3488,4471,1442314821
3rzwfg,t3_3rzwfg,http://imgur.com/YNkejWz,4231,0,1446982774,Children in an iron lung before the advent of the polio vaccination (1937),https://www.reddit.com/r/creepy/comments/3rzwfg/children_in_an_iron_lung_before_the_advent_of_the/,creepy,777,tunafan6,7661,1520,1439585413
3aa6ml,t3_3aa6ml,http://i.imgur.com/yFcUeZs.jpeg,4230,0,1434633643,"A suspicious white van was reported driving around my hometown, stopping to talk to kids but speeding away when adults showed up. The sheriff's department posted this on their Facebook as the ""Suspect Vehicle"".",https://www.reddit.com/r/creepy/comments/3aa6ml/a_suspicious_white_van_was_reported_driving/,creepy,539,BlackFaceCowboy,9835,1307,1417103016
57be99,t3_57be99,http://i.imgur.com/CokSu4J.png,4217,0,1476378733,The Two Thousand Yard Stare,https://www.reddit.com/r/creepy/comments/57be99/the_two_thousand_yard_stare/,creepy,640,iambecomedeath7,22244,67188,1249344609
39osr7,t3_39osr7,http://i.imgur.com/bSP7fQn.jpg,4215,0,1434185467,The Tickle Monster,https://www.reddit.com/r/creepy/comments/39osr7/the_tickle_monster/,creepy,236,Wraymaster,3332,5270,1310856562
3esrdb,t3_3esrdb,http://imgur.com/kOIpyWY,4212,0,1438020660,"This is the mummified corpse of Si Quey, the most famous serial killer of Thai history. He was captured and executed by hanging in 1950. After the autopsy, the corpse was filled and covered with paraffin wax to preserve it.",https://www.reddit.com/r/creepy/comments/3esrdb/this_is_the_mummified_corpse_of_si_quey_the_most/,creepy,656,smallsea,14895,8237,1432010974
3usopl,t3_3usopl,http://i.imgur.com/O51FxIf.jpg,4211,0,1448850687,My cousins son has been photocopying his toys and leaving the pictures all over the house,https://www.reddit.com/r/creepy/comments/3usopl/my_cousins_son_has_been_photocopying_his_toys_and/,creepy,253,LadyPique,4606,527,1442679010
2h0jiy,t3_2h0jiy,http://imgur.com/FdA5swa,4198,0,1411279474,Artist suffering from schizophrenia would draw what she saw on her walls.,https://www.reddit.com/r/creepy/comments/2h0jiy/artist_suffering_from_schizophrenia_would_draw/,creepy,474,PeacefulC,2342,142,1357004993
50ylwq,t3_50ylwq,https://i.redd.it/jztrkx9s3bjx.jpg,4192,0,1472905887,"Message left at murder scene by ""The Lipstick Killer"" William Heirens",https://www.reddit.com/r/creepy/comments/50ylwq/message_left_at_murder_scene_by_the_lipstick/,creepy,312,sivribiber,417989,9310,1469036406
38k939,t3_38k939,http://imgur.com/iIUL8oB,4191,0,1433446852,My dad posts things like this to my facebook timeline,https://www.reddit.com/r/creepy/comments/38k939/my_dad_posts_things_like_this_to_my_facebook/,creepy,669,Idodrunkthings,11719,27134,1420692855
3uvwv2,t3_3uvwv2,http://imgur.com/a/c1TeX,4189,0,1448909297,A kid someone went to high school with shoots creepy pictures...,https://www.reddit.com/r/creepy/comments/3uvwv2/a_kid_someone_went_to_high_school_with_shoots/,creepy,891,chromecarz00,9098,8021,1378510049
2neetb,t3_2neetb,http://imgur.com/a/5PECO,4188,0,1416943409,The black swallower. This is a real fish.,https://www.reddit.com/r/creepy/comments/2neetb/the_black_swallower_this_is_a_real_fish/,creepy,577,The2500,211623,40461,1309312193
2y5n56,t3_2y5n56,http://imgur.com/7T1U1s9,4179,0,1425664473,"If you mirror Tommy Lee Jones' Two-Face, it comes out scary as hell",https://www.reddit.com/r/creepy/comments/2y5n56/if_you_mirror_tommy_lee_jones_twoface_it_comes/,creepy,445,tastybabysoup,10351,28113,1298644048
2i5ssp,t3_2i5ssp,http://i.imgur.com/3lNLRHB.jpg,4178,0,1412310144,Now we wait........... Muaaahahahahahaha,https://www.reddit.com/r/creepy/comments/2i5ssp/now_we_wait_muaaahahahahahaha/,creepy,514,WillsMyth,8718,11059,1381279008
3qwtpt,t3_3qwtpt,http://i.imgur.com/6tpZsuS.jpg,4174,0,1446251592,My friend caught this guy in town yesterday,https://www.reddit.com/r/creepy/comments/3qwtpt/my_friend_caught_this_guy_in_town_yesterday/,creepy,299,ultimatecaissie,9950,36759,1390255582
4o73al,t3_4o73al,http://imgur.com/xxZcyXD,4172,0,1465994244,Found on a walk in the park,https://www.reddit.com/r/creepy/comments/4o73al/found_on_a_walk_in_the_park/,creepy,388,groblin_thrilliams,3527,290,1449576786
3j031x,t3_3j031x,http://imgur.com/Qp1jPj5,4171,0,1440970755,Fenrir Greyback portrait from the Harry Potter Creature Vault book,https://www.reddit.com/r/creepy/comments/3j031x/fenrir_greyback_portrait_from_the_harry_potter/,creepy,396,KelleyBuckley,7381,715,1410457459
4pwt08,t3_4pwt08,http://i.imgur.com/3Op1IG3.jpg,4168,0,1466927467,Children tree,https://www.reddit.com/r/creepy/comments/4pwt08/children_tree/,creepy,288,CindyLouBou,3316,355,1255394387
3sykpd,t3_3sykpd,http://imgur.com/Mgkhwqs,4167,0,1447634019,Notice,https://www.reddit.com/r/creepy/comments/3sykpd/notice/,creepy,180,down-n-out,8355,697,1440533560
50ba31,t3_50ba31,https://i.redd.it/1guyvvay0jix.jpg,4166,0,1472565940,Ophiocordyceps Unilateralis - A type of fungi that kills ants from within,https://www.reddit.com/r/creepy/comments/50ba31/ophiocordyceps_unilateralis_a_type_of_fungi_that/,creepy,453,Dankmemer64,4628,4212,1446475505
30hjk1,t3_30hjk1,http://i.imgur.com/UyuazMK.jpg,4166,0,1427461364,"Circus Dwarf, Palisades, New Jersey, 1958 (X-post Historyporn)",https://www.reddit.com/r/creepy/comments/30hjk1/circus_dwarf_palisades_new_jersey_1958_xpost/,creepy,315,Ridikulus,51413,12675,1304339855
3k0qt7,t3_3k0qt7,http://imgur.com/j5OAIzN,4163,0,1441663761,My Mom and her family in 1948 - they look like fucking serial killers....,https://www.reddit.com/r/creepy/comments/3k0qt7/my_mom_and_her_family_in_1948_they_look_like/,creepy,272,OutTheAudi,3095,42,1430265350
1uk1sf,t3_1uk1sf,http://i.imgur.com/oEBlsoY.jpg,4161,0,1389034572,Guess I wasn't home alone all of last night. Woke up this morning and found this out of my patio door...,https://www.reddit.com/r/creepy/comments/1uk1sf/guess_i_wasnt_home_alone_all_of_last_night_woke/,creepy,594,stearnsy13,4821,9764,1361564683
4yc7kw,t3_4yc7kw,http://imgur.com/x13r5pG,4156,0,1471526375,The Shining,https://www.reddit.com/r/creepy/comments/4yc7kw/the_shining/,creepy,896,spider_cereal,106199,4338,1337262102
3jcfts,t3_3jcfts,http://imgur.com/a/k1Hw8,4154,0,1441193637,The Dead Children's Playground.,https://www.reddit.com/r/creepy/comments/3jcfts/the_dead_childrens_playground/,creepy,589,furyofsound,38918,6353,1384384338
3joxah,t3_3joxah,http://i.imgur.com/DFoEwlT.jpg,4148,0,1441416065,A guy from my town murdered an 18 year old girl at Mt. Cheaha the other day. He posted this picture on Instagram hours before (article in comments),https://www.reddit.com/r/creepy/comments/3joxah/a_guy_from_my_town_murdered_an_18_year_old_girl/,creepy,1863,fight-milk,5119,1167,1435560294
3f3u4h,t3_3f3u4h,http://i.imgur.com/LY4tfiJ.jpg,4147,0,1438220209,Mom sent me to the store last night and I started feeling a horrible vibe the closer I got. Then this is what I found upon arriving. I actually couldn't bring myself to go in.,https://www.reddit.com/r/creepy/comments/3f3u4h/mom_sent_me_to_the_store_last_night_and_i_started/,creepy,1267,Snaab,20039,16728,1279585224
3pwozr,t3_3pwozr,https://i.imgur.com/4Fbi5tV.jpg,4141,0,1445608954,Giant Monkfish,https://www.reddit.com/r/creepy/comments/3pwozr/giant_monkfish/,creepy,700,ethan_kahn,2397426,70380,1328043893
31kb49,t3_31kb49,http://imgur.com/v0M3D48,4140,0,1428272903,I see your friend's old Easter picture and raise you my friend's equally creepy old Easter picture.,https://www.reddit.com/r/creepy/comments/31kb49/i_see_your_friends_old_easter_picture_and_raise/,creepy,202,_loathed,9104,313,1421427994
4u1dej,t3_4u1dej,http://imgur.com/5mIhSNY,4137,0,1469167164,Carved Pearls,https://www.reddit.com/r/creepy/comments/4u1dej/carved_pearls/,creepy,133,ribbitribbitrabbit,295869,33247,1343676418
2f2d3n,t3_2f2d3n,http://i.imgur.com/U9Z82zA.jpg,4136,0,1409464936,My girlfriend was taking a panorama of our room and I changed just at the right time,https://www.reddit.com/r/creepy/comments/2f2d3n/my_girlfriend_was_taking_a_panorama_of_our_room/,creepy,800,trevordrum,3410,4113,1308802016
3w5l0e,t3_3w5l0e,http://i.imgur.com/S4AlUWW.jpg,4128,0,1449710199,A human brain with no ridges,https://www.reddit.com/r/creepy/comments/3w5l0e/a_human_brain_with_no_ridges/,creepy,1379,moldy_melon,3536,11,1442267022
2ejhhx,t3_2ejhhx,http://i.imgur.com/5v9BY5S.png,4104,0,1408983883,"Walking back to your hotel room, when you realize that you are facing a clock tower with torture chamber beneath, and across the street was the house where Vlad the Impaler, a.k.a. Draculae, is said to have been born in 1431.",https://www.reddit.com/r/creepy/comments/2ejhhx/walking_back_to_your_hotel_room_when_you_realize/,creepy,194,mega002,218844,13944,1339336181
4gtp4c,t3_4gtp4c,http://imgur.com/2zlTKbX,4101,0,1461845661,It's just... unsettling (x-post /r/scp),https://www.reddit.com/r/creepy/comments/4gtp4c/its_just_unsettling_xpost_rscp/,creepy,375,zencodism,3318,169,1410903598
4k36i8,t3_4k36i8,https://i.reddituploads.com/85ab2236afd846329dabbe2b87d9cfba?fit=max&h=1536&w=1536&s=759c62d1f20391234480ab6a61bbf252,4099,0,1463673900,My friend's childhood halloween costume is perfect.,https://www.reddit.com/r/creepy/comments/4k36i8/my_friends_childhood_halloween_costume_is_perfect/,creepy,199,twodadshuggin,10341,1128,1422756950
4bc4dx,t3_4bc4dx,http://i.imgur.com/KmWAG78.jpg,4098,0,1458564719,why is it wearing an apron,https://www.reddit.com/r/creepy/comments/4bc4dx/why_is_it_wearing_an_apron/,creepy,335,Miskatonica,203462,9565,1455629593
48sdh9,t3_48sdh9,http://i.imgur.com/CCwdwxi.jpg,4095,0,1457018083,Plague doctors,https://www.reddit.com/r/creepy/comments/48sdh9/plague_doctors/,creepy,249,wooly_mastodon,115972,2740,1453258616
4qxzi5,t3_4qxzi5,http://www.cvltnation.com/wp-content/uploads/2014/12/Paisley_Abbey_gargoyle_10.jpg,4079,0,1467478321,This Paisley Abbey Gargoyle,https://www.reddit.com/r/creepy/comments/4qxzi5/this_paisley_abbey_gargoyle/,creepy,477,Piscator629,263822,71916,1315683709
4gzi7m,t3_4gzi7m,http://imgur.com/T5oIyNY,4076,0,1461938461,I'm feeling . . . happy. Which is a big deal for me.,https://www.reddit.com/r/creepy/comments/4gzi7m/im_feeling_happy_which_is_a_big_deal_for_me/,creepy,499,PhaedrusBE,4188,14247,1453731003
316j3j,t3_316j3j,http://i.imgur.com/nBqJZDY.jpg,4071,0,1427974558,"Stephen King standing at the gate of his house in Bangor, Maine.",https://www.reddit.com/r/creepy/comments/316j3j/stephen_king_standing_at_the_gate_of_his_house_in/,creepy,612,journeyman369,36047,6443,1407377720
54ef6m,t3_54ef6m,http://imgur.com/a/kxb95,4068,0,1474794534,Art in a local mental hospital in Germany,https://www.reddit.com/r/creepy/comments/54ef6m/art_in_a_local_mental_hospital_in_germany/,creepy,338,ASoulForNevermore,3109,3361,1379373363
3j399c,t3_3j399c,http://i.imgur.com/UZz5DaW.jpg,4064,0,1441032095,Collection of masks designed to protect doctors from the plague,https://www.reddit.com/r/creepy/comments/3j399c/collection_of_masks_designed_to_protect_doctors/,creepy,444,Forlurn,108221,35932,1392761940
3wy1fb,t3_3wy1fb,http://imgur.com/roi63Rj,4059,0,1450191326,Imaginary friend?,https://www.reddit.com/r/creepy/comments/3wy1fb/imaginary_friend/,creepy,236,spider_cereal,106199,4338,1337262102
4ea496,t3_4ea496,http://i.imgur.com/5ogNTrt.jpg,4057,0,1460369848,Photographer swims with massive anaconda,https://www.reddit.com/r/creepy/comments/4ea496/photographer_swims_with_massive_anaconda/,creepy,497,ivealreadyreddit,32586,1426,1299887671
52ryfl,t3_52ryfl,https://i.redd.it/zoeolf4jejlx.jpg,4057,0,1473878024,A Norwegian artist using dead hands to finger-paint his masterpieces....,https://www.reddit.com/r/creepy/comments/52ryfl/a_norwegian_artist_using_dead_hands_to/,creepy,784,DillyDylan,165040,4305,1467527671
2sejll,t3_2sejll,http://i.imgur.com/Nvv2y.jpg,4044,0,1421246864,Person found this photo when checking their GoPro after surfing.,https://www.reddit.com/r/creepy/comments/2sejll/person_found_this_photo_when_checking_their_gopro/,creepy,1676,vkapustin,34683,32927,1334272429
36kdoz,t3_36kdoz,http://i1105.photobucket.com/albums/h348/Zhakrin/IMG_3010_zpszqqdny9l.jpg,4040,0,1432083373,Watching a Zombie film. I turn towards my sons monitor and screamed. Wife almost wet herself...,https://www.reddit.com/r/creepy/comments/36kdoz/watching_a_zombie_film_i_turn_towards_my_sons/,creepy,310,Black-Zero,3904,12184,1323690254
33xy05,t3_33xy05,http://imgur.com/K2I6ucc,4036,0,1430072910,"The ""Haserot Angel"" of Lakeview Cemetery in Cleveland, Ohio",https://www.reddit.com/r/creepy/comments/33xy05/the_haserot_angel_of_lakeview_cemetery_in/,creepy,264,hendermeimer,4403,344,1383522123
3rrfdy,t3_3rrfdy,http://i.imgur.com/2GYqWXU.jpg,4030,0,1446817272,Foggy house,https://www.reddit.com/r/creepy/comments/3rrfdy/foggy_house/,creepy,201,ethan_kahn,2397426,70380,1328043893
4qfovu,t3_4qfovu,https://i.redd.it/ee8dw051l86x.jpg,4022,0,1467209316,"Taken at the bottom of the suicide cliffs in Okinawa, Japan.",https://www.reddit.com/r/creepy/comments/4qfovu/taken_at_the_bottom_of_the_suicide_cliffs_in/,creepy,1096,Jeffblla,3176,821,1464568232
2lsm12,t3_2lsm12,http://i.imgur.com/SolCd4O.jpg,4017,0,1415567400,Darkness has fallen,https://www.reddit.com/r/creepy/comments/2lsm12/darkness_has_fallen/,creepy,307,OaSoaD,16121,11869,1382409139
55ik36,t3_55ik36,https://i.redd.it/r1qyui41t2px.jpg,4012,0,1475420496,"Have a seat, we've been expecting you...",https://www.reddit.com/r/creepy/comments/55ik36/have_a_seat_weve_been_expecting_you/,creepy,392,jaykirsch,336409,20512,1449188834
2xo0bb,t3_2xo0bb,http://imgur.com/mrpYy64,4002,0,1425303517,TIL Yoko Ono used John Lennon's blood stained glasses from the day he was shot as a prop for her album art.,https://www.reddit.com/r/creepy/comments/2xo0bb/til_yoko_ono_used_john_lennons_blood_stained/,creepy,1333,cheftlp1221,93364,185625,1357244378
37dtgy,t3_37dtgy,http://imgur.com/ThjKR80,3999,0,1432678335,My mom had this made for her jewelry and I'm starting to question her sanity.,https://www.reddit.com/r/creepy/comments/37dtgy/my_mom_had_this_made_for_her_jewelry_and_im/,creepy,230,Quantx,3177,1168,1386281923
3e9p5p,t3_3e9p5p,http://d11cbnttr0b724.cloudfront.net/img_dreamed/437898.jpg,3993,0,1437614002,I put a double exposure I took into the Google Deep Dream thingy and this was the result.,https://www.reddit.com/r/creepy/comments/3e9p5p/i_put_a_double_exposure_i_took_into_the_google/,creepy,254,theUSpopulation,17456,8289,1432433045
2sij3c,t3_2sij3c,http://imgur.com/CCjxv0l,3988,0,1421330347,This changed my outlook on life.,https://www.reddit.com/r/creepy/comments/2sij3c/this_changed_my_outlook_on_life/,creepy,2012,Trevor_Roll,7939,3997,1417138114
45krzx,t3_45krzx,http://i.imgur.com/9P5n4Yh.png,3986,0,1455375857,"When feeling alone, remember that Demodex is always with you, in your eyelashes.",https://www.reddit.com/r/creepy/comments/45krzx/when_feeling_alone_remember_that_demodex_is/,creepy,693,sleale,3417,974,1454522908
39uktg,t3_39uktg,http://i.imgur.com/Guzcyzz.jpg,3971,0,1434320744,This birthday party.,https://www.reddit.com/r/creepy/comments/39uktg/this_birthday_party/,creepy,390,Polemus,25780,31127,1330352289
49dotb,t3_49dotb,http://i.imgur.com/OkIHYRQ.jpg,3969,0,1457371686,"sometimes you should just leave the exposure dial in Lightroom alone... that's just a reflection, right??",https://www.reddit.com/r/creepy/comments/49dotb/sometimes_you_should_just_leave_the_exposure_dial/,creepy,485,kalahar,5458,2900,1289925024
4c5vi8,t3_4c5vi8,http://imgur.com/NBE0tlE,3969,0,1459091829,The lighting at a school by my house made it look like aliens were landing,https://www.reddit.com/r/creepy/comments/4c5vi8/the_lighting_at_a_school_by_my_house_made_it_look/,creepy,152,souptobolts,3161,50,1433645018
2dmdyc,t3_2dmdyc,http://imgur.com/EquD7xk,3953,0,1408095672,Samurai,https://www.reddit.com/r/creepy/comments/2dmdyc/samurai/,creepy,283,Mr_Franklyn,2789,57,1408012680
4wy9a5,t3_4wy9a5,http://i.imgur.com/g7lHtag.jpg,3940,0,1470773797,The statue being swallowed by a tree,https://www.reddit.com/r/creepy/comments/4wy9a5/the_statue_being_swallowed_by_a_tree/,creepy,173,swenkortig,3786,3983,1465781185
2bode8,t3_2bode8,http://imgur.com/sMKzrtz,3938,0,1406277394,Girl and chicken face swap,https://www.reddit.com/r/creepy/comments/2bode8/girl_and_chicken_face_swap/,creepy,366,vivadpr,2763,4,1406077291
30sxxv,t3_30sxxv,http://imgur.com/9sVvaP3,3932,0,1427721782,Weirdest thing I've ever seen in Times Square,https://www.reddit.com/r/creepy/comments/30sxxv/weirdest_thing_ive_ever_seen_in_times_square/,creepy,452,N/A,0,0,0
2xjkt6,t3_2xjkt6,http://i.imgur.com/eW2pOv4.jpg,3930,0,1425194861,Delivering pizzas at 2am and this just scared the shit out of me...,https://www.reddit.com/r/creepy/comments/2xjkt6/delivering_pizzas_at_2am_and_this_just_scared_the/,creepy,211,ChaBoy336,3267,233,1404406649
3d0fhu,t3_3d0fhu,http://imgur.com/fw0UQjc,3922,0,1436707455,"Play with me, Edward",https://www.reddit.com/r/creepy/comments/3d0fhu/play_with_me_edward/,creepy,890,N/A,0,0,0
4256w6,t3_4256w6,http://imgur.com/1n26zXw,3920,0,1453463277,Mother centipede cradles her young,https://www.reddit.com/r/creepy/comments/4256w6/mother_centipede_cradles_her_young/,creepy,1249,ivealreadyreddit,32586,1426,1299887671
3cltzu,t3_3cltzu,http://imgur.com/KqOE6Gy,3904,0,1436394464,Today is a glorious day. He has arisen.,https://www.reddit.com/r/creepy/comments/3cltzu/today_is_a_glorious_day_he_has_arisen/,creepy,541,WharfBlarg,7551,4683,1361411687
4hmzo6,t3_4hmzo6,http://i.imgur.com/cg3rHj5.jpg,3902,0,1462278410,The Huldra. Norwegian maiden of the forest.,https://www.reddit.com/r/creepy/comments/4hmzo6/the_huldra_norwegian_maiden_of_the_forest/,creepy,548,PM_ME_JAR_JAR_NUDES,3702,30548,1450687871
3u3c2n,t3_3u3c2n,http://i.imgur.com/cOrSnbk.jpg,3902,0,1448381702,Abandoned Tree Farm,https://www.reddit.com/r/creepy/comments/3u3c2n/abandoned_tree_farm/,creepy,356,Ein-MacDouglass,7084,220,1438567189
4sb7ra,t3_4sb7ra,http://i.imgur.com/rMCWcz4.jpg,3898,0,1468247874,Unpacking human skulls,https://www.reddit.com/r/creepy/comments/4sb7ra/unpacking_human_skulls/,creepy,288,i124qnds,1267942,160875,1460649818
4vvd4t,t3_4vvd4t,http://imgur.com/ozPs0q3,3896,0,1470178523,"Gas Masks For Babies Tested At An English Hospital, 1940.",https://www.reddit.com/r/creepy/comments/4vvd4t/gas_masks_for_babies_tested_at_an_english/,creepy,252,someguyfromwinnipeg,3468,7745,1428042709
4o1khy,t3_4o1khy,http://imgur.com/a/04UIu,3891,0,1465913507,"Condemned duplex directly beside my best friends duplex was forced open last night. We went in just to check it out, got much more than we bargained for.",https://www.reddit.com/r/creepy/comments/4o1khy/condemned_duplex_directly_beside_my_best_friends/,creepy,1424,Asherbaby,8730,2286,1349630990
3x3s7b,t3_3x3s7b,http://imgur.com/k6e6qG0,3889,0,1450288561,Interesting little statues,https://www.reddit.com/r/creepy/comments/3x3s7b/interesting_little_statues/,creepy,256,spider_cereal,106199,4338,1337262102
3l1uxz,t3_3l1uxz,http://imgur.com/RjjgFoM,3878,0,1442330447,It dug its fangs into my rubber gloves the second I picked it up.,https://www.reddit.com/r/creepy/comments/3l1uxz/it_dug_its_fangs_into_my_rubber_gloves_the_second/,creepy,1089,N/A,0,0,0
4ohddk,t3_4ohddk,http://imgur.com/nwC0GwU,3847,0,1466134812,Parking lot inhabitant,https://www.reddit.com/r/creepy/comments/4ohddk/parking_lot_inhabitant/,creepy,323,KevlarYarmulke,3359433,87436,1322109857
49tmk5,t3_49tmk5,http://imgur.com/pUdcoRu,3831,0,1457620009,Children during the Chechnya bombings,https://www.reddit.com/r/creepy/comments/49tmk5/children_during_the_chechnya_bombings/,creepy,786,PervyCacti,21600,1533,1404264346
3kji7o,t3_3kji7o,http://imgur.com/5XbKwJU,3831,0,1441979166,I'd stay away from Springfield if I were you...,https://www.reddit.com/r/creepy/comments/3kji7o/id_stay_away_from_springfield_if_i_were_you/,creepy,229,zehr79,8040,311,1331099918
334kmc,t3_334kmc,http://imgur.com/F29EwP9,3828,0,1429452653,Creepiest urinal I've ever had the chance to pee in.,https://www.reddit.com/r/creepy/comments/334kmc/creepiest_urinal_ive_ever_had_the_chance_to_pee_in/,creepy,320,ubiqwitus,5916,816,1283663984
388ikc,t3_388ikc,http://imgur.com/J4HiyJh,3824,0,1433262889,The sculptures adorning my apartment building are kind of unsettling,https://www.reddit.com/r/creepy/comments/388ikc/the_sculptures_adorning_my_apartment_building_are/,creepy,292,TheyCallMeArtemis,6241,960,1415346921
2izbhv,t3_2izbhv,http://i.imgur.com/cNuSCFt.jpg,3822,0,1413066419,Cyborg Vampire,https://www.reddit.com/r/creepy/comments/2izbhv/cyborg_vampire/,creepy,288,GageHollis1,5513,1,1366239964
29blqq,t3_29blqq,http://i.imgur.com/guMCFeF.jpg,3820,0,1403964695,My biggest fear..,https://www.reddit.com/r/creepy/comments/29blqq/my_biggest_fear/,creepy,585,jeroen1322,7002,1207,1387407733
3cxpcr,t3_3cxpcr,http://imgur.com/ACsyVO9,3819,0,1436639901,I will never put on a pair of gloves the same anymore,https://www.reddit.com/r/creepy/comments/3cxpcr/i_will_never_put_on_a_pair_of_gloves_the_same/,creepy,676,Iheartmyhonda1,3086,14,1379394438
38xd3f,t3_38xd3f,http://i.imgur.com/hFTaK7I.jpg,3811,0,1433698006,An abandoned Hungarian lake village.,https://www.reddit.com/r/creepy/comments/38xd3f/an_abandoned_hungarian_lake_village/,creepy,199,Oda_nicullah,362920,15075,1370298392
4m6sl2,t3_4m6sl2,http://imgur.com/3EcrNb7,3804,0,1464868763,"Sparrow, Oil on board, 18x24in (x-post r/art)",https://www.reddit.com/r/creepy/comments/4m6sl2/sparrow_oil_on_board_18x24in_xpost_rart/,creepy,222,TheRealestOne,21224,3274,1354316965
3qf2ir,t3_3qf2ir,http://imgur.com/XXIZGAj,3801,0,1445953404,He knows when you are sleeping........,https://www.reddit.com/r/creepy/comments/3qf2ir/he_knows_when_you_are_sleeping/,creepy,210,Outcastedredditor,56302,671,1345621425
3lvh8i,t3_3lvh8i,http://imgur.com/1FUaynB,3794,0,1442880715,Abandoned bowling alley.,https://www.reddit.com/r/creepy/comments/3lvh8i/abandoned_bowling_alley/,creepy,291,Sippingin,1801677,75679,1417498134
35tixb,t3_35tixb,http://i.imgur.com/xcMQvAb.jpg,3793,0,1431516951,We all float down here...,https://www.reddit.com/r/creepy/comments/35tixb/we_all_float_down_here/,creepy,379,CrimsonKing1029,46006,20324,1410387426
3n1ud5,t3_3n1ud5,http://i.imgur.com/rDxy9dH.png,3786,0,1443665910,A local man from the 1950's who dressed as an alien to scare people by running across the road.,https://www.reddit.com/r/creepy/comments/3n1ud5/a_local_man_from_the_1950s_who_dressed_as_an/,creepy,254,TheLonerRanger,2718,1257,1373532537
4az15u,t3_4az15u,http://img13.deviantart.net/2034/i/2005/140/7/4/vulture_chick__view_1_by_cermaith.jpg,3782,0,1458318141,Vulture chick,https://www.reddit.com/r/creepy/comments/4az15u/vulture_chick/,creepy,367,gachzorge,5966,2527,1423501745
