id,name,url,ups,downs,created_utc,title,permalink,subreddit,num_comments,author,author_link_karma,author_comment_karma,author_created_utc
3svmej,t3_3svmej,http://imgur.com/a/nuE98,7724,0,1447575277,tl;dr : I'm dumb when scary things happen to me...,https://www.reddit.com/r/creepy/comments/3svmej/tldr_im_dumb_when_scary_things_happen_to_me/,creepy,329,Prischool,9457,6037,1363514726
4xznfz,t3_4xznfz,https://i.reddituploads.com/a3c1503f7c0e48e99a54b749525656f1?fit=max&h=1536&w=1536&s=2bb13a3f902a3095688a3c1bf2d080f8,7485,0,1471356284,"Got a notification from my smart home app in the middle of the night saying ""Your doorbell detected a visitor"".",https://www.reddit.com/r/creepy/comments/4xznfz/got_a_notification_from_my_smart_home_app_in_the/,creepy,4636,FatNDepressed,5286,1564,1454377804
3hgls2,t3_3hgls2,https://i.imgur.com/RxJ6wqi.jpg,7437,0,1439913990,The bow of this sunken ship looks like a giant fish's mouth.,https://www.reddit.com/r/creepy/comments/3hgls2/the_bow_of_this_sunken_ship_looks_like_a_giant/,creepy,322,JeantheDragon,27123,1733,1415825867
4l5wa3,t3_4l5wa3,http://imgur.com/a/n7D1u,7077,0,1464277024,"Let me walk you through the CREEPIEST, CRAZIEST crime scene ever...",https://www.reddit.com/r/creepy/comments/4l5wa3/let_me_walk_you_through_the_creepiest_craziest/,creepy,2743,zentini,5978,384,1414245841
33pjo8,t3_33pjo8,http://imgur.com/OWyEpJa,6777,0,1429882211,"My friend took this pic in Chile, when the volcano was erupting. Looks very eerie...",https://www.reddit.com/r/creepy/comments/33pjo8/my_friend_took_this_pic_in_chile_when_the_volcano/,creepy,1053,Bemy_Gunshot,31839,21238,1317931087
4aq5tr,t3_4aq5tr,http://imgur.com/9jr2NGb,6758,0,1458167183,"""Necropants"" (pants made from human skin) on display in the Museum of Icelandic Sorcery and Witchcraft.",https://www.reddit.com/r/creepy/comments/4aq5tr/necropants_pants_made_from_human_skin_on_display/,creepy,924,The_Iron_Zeppelin,15211,13165,1424343218
3g8omz,t3_3g8omz,http://imgur.com/IvDm1za,6752,0,1439039818,Spider eyes taken with a microscope camera,https://www.reddit.com/r/creepy/comments/3g8omz/spider_eyes_taken_with_a_microscope_camera/,creepy,488,spider_cereal,106199,4338,1337262102
3h8rta,t3_3h8rta,http://i.imgur.com/Vb7PC6y.jpg,6733,0,1439762098,Friend was digging in garden. Iris root looked like dead baby foot.,https://www.reddit.com/r/creepy/comments/3h8rta/friend_was_digging_in_garden_iris_root_looked/,creepy,245,faux_pseudo,17787,17095,1310517264
2huuw5,t3_2huuw5,http://i.imgur.com/CY3Xmtr.jpg,6712,0,1412047900,This was my walk at university...,https://www.reddit.com/r/creepy/comments/2huuw5/this_was_my_walk_at_university/,creepy,482,Theconspiracyunfolds,3357,406,1345689783
3yo34g,t3_3yo34g,http://imgur.com/n8ABOnz,6507,0,1451406443,This abandoned hospital had a visitor last night,https://www.reddit.com/r/creepy/comments/3yo34g/this_abandoned_hospital_had_a_visitor_last_night/,creepy,1045,DedicatedSloth,20495,1189,1338798251
3aq6q0,t3_3aq6q0,http://i.imgur.com/KdLA6c8.jpg,6476,0,1434991447,An Abandoned church in the Czech Republic filled with......Ghost statues,https://www.reddit.com/r/creepy/comments/3aq6q0/an_abandoned_church_in_the_czech_republic_filled/,creepy,559,Mafia-Hitman,0,0,0
3mhe3k,t3_3mhe3k,http://imgur.com/Eu988fE,6455,0,1443286854,Found some friends in a mile-long tunnel that travels beneath my apartment building.,https://www.reddit.com/r/creepy/comments/3mhe3k/found_some_friends_in_a_milelong_tunnel_that/,creepy,913,holleyfieldart,6912,3794,1401842640
3diote,t3_3diote,http://imgur.com/a/tWY1o,6451,0,1437063309,People Who Live On This Island Kill Anybody Who Tries To Come Ashore,https://www.reddit.com/r/creepy/comments/3diote/people_who_live_on_this_island_kill_anybody_who/,creepy,4798,Ghost_Animator,1493327,54897,1404314687
549xm2,t3_549xm2,https://i.reddituploads.com/7f67c3ae92d74663b54868d530f2d98e?fit=max&h=1536&w=1536&s=10b905eec29fd29939af36a426876b22,6365,0,1474720402,Famine Memorial in Dublin,https://www.reddit.com/r/creepy/comments/549xm2/famine_memorial_in_dublin/,creepy,1644,ProxyKat,5108,25,1474659921
4f29rr,t3_4f29rr,http://i.imgur.com/G9N5b03.jpg,6349,0,1460819615,You probably shouldn't swim in the ocean at night.,https://www.reddit.com/r/creepy/comments/4f29rr/you_probably_shouldnt_swim_in_the_ocean_at_night/,creepy,1078,SeriesOfAdjectives,212996,312773,1439426029
2v9kky,t3_2v9kky,http://i.imgur.com/dbGcYhD.jpg,6305,0,1423454785,I think her mirror is broken...,https://www.reddit.com/r/creepy/comments/2v9kky/i_think_her_mirror_is_broken/,creepy,315,ghyit1,4408,2129,1404703524
4zdg76,t3_4zdg76,http://imgur.com/mdoRqD7,6225,0,1472056307,I work at a state park. Was exploring one of the abandoned buildings and decided to check out the bathroom. I promptly shit myself.,https://www.reddit.com/r/creepy/comments/4zdg76/i_work_at_a_state_park_was_exploring_one_of_the/,creepy,571,moralanarchy,28450,18927,1351218483
3i3zse,t3_3i3zse,http://i.imgur.com/yQ7yWZN.jpg,6213,0,1440357889,A spider washed down my drain and when I tried to take a picture there was something else staring back,https://www.reddit.com/r/creepy/comments/3i3zse/a_spider_washed_down_my_drain_and_when_i_tried_to/,creepy,1161,Jancer16,8540,1223,1335712280
489urr,t3_489urr,http://i.imgur.com/iX23qfn.jpg,6131,0,1456746745,Mummified body of German adventurer who vanished is found inside drifting yacht,https://www.reddit.com/r/creepy/comments/489urr/mummified_body_of_german_adventurer_who_vanished/,creepy,1269,stony_phased,8343,27334,1304012773
2k4ala,t3_2k4ala,http://imgur.com/itBE6hT,6090,0,1414089060,Man prints a photo of his face on photo paper and places it in a jar with green water to scare his wife on Halloween,https://www.reddit.com/r/creepy/comments/2k4ala/man_prints_a_photo_of_his_face_on_photo_paper_and/,creepy,420,Spiderjohns,7360,715,1360904034
4ku06r,t3_4ku06r,https://i.imgur.com/4j14cpc.jpg,6047,0,1464099757,"Xylaria polymorpha, commonly known as dead man's fingers, is a saprobic fungus.",https://www.reddit.com/r/creepy/comments/4ku06r/xylaria_polymorpha_commonly_known_as_dead_mans/,creepy,432,unknown_name,1936815,147682,1300825028
452ki6,t3_452ki6,http://imgur.com/jQGOSbF,5955,0,1455109311,What the storm brought to the French shores,https://www.reddit.com/r/creepy/comments/452ki6/what_the_storm_brought_to_the_french_shores/,creepy,626,Alehins,6412,14,1308300661
4kzb6o,t3_4kzb6o,http://imgur.com/lG1FV5A,5928,0,1464178122,Cthulhu Rising,https://www.reddit.com/r/creepy/comments/4kzb6o/cthulhu_rising/,creepy,831,EpsilonSoTrill,4201,394,1424927199
4j00nn,t3_4j00nn,http://i.imgur.com/bmqwOXL.jpg,5872,0,1463048481,Mussolini's headquarters,https://www.reddit.com/r/creepy/comments/4j00nn/mussolinis_headquarters/,creepy,1344,_TheChainsOfMarkov_,166390,5736,1434591220
4ttg59,t3_4ttg59,http://imgur.com/kjbl0Ma,5862,0,1469049720,Realistic Venom,https://www.reddit.com/r/creepy/comments/4ttg59/realistic_venom/,creepy,812,spider_cereal,106199,4338,1337262102
3lzsiq,t3_3lzsiq,http://i.imgur.com/LeVnRZb.jpg,5793,0,1442961053,Serial killer Joseph Metheny who owned a burger stand and claimed to have sold burgers with his victims' flesh,https://www.reddit.com/r/creepy/comments/3lzsiq/serial_killer_joseph_metheny_who_owned_a_burger/,creepy,1556,pexifissy,12324,4256,1434554110
4nrtc7,t3_4nrtc7,http://imgur.com/jVDRWZo,5770,0,1465759590,Never seen anything like these trees in my local cemetery.,https://www.reddit.com/r/creepy/comments/4nrtc7/never_seen_anything_like_these_trees_in_my_local/,creepy,371,VioletElephant,4316,269,1436375533
2v3t29,t3_2v3t29,http://i.imgur.com/pmum9rz.jpg,5758,0,1423329646,"Today i'm moving, so I decided to leave a little present for the next tenants.",https://www.reddit.com/r/creepy/comments/2v3t29/today_im_moving_so_i_decided_to_leave_a_little/,creepy,831,SupremeWizard,3879,2639,1378702430
41h2xf,t3_41h2xf,http://i.imgur.com/y7WPzWk.jpg,5731,0,1453087877,"I heard my violin strings being plucked one night as I laid alone in the dark. Full of anxiety, I mustered up my courage, jumped off my bed and flashed a picture, hoping to capture a shot of my spooky, musical intruder. I succeeded.",https://www.reddit.com/r/creepy/comments/41h2xf/i_heard_my_violin_strings_being_plucked_one_night/,creepy,929,wholligan,8873,21743,1364559497
4xdzza,t3_4xdzza,https://i.imgur.com/9lNnbIE.jpg,5724,0,1471014739,Why wait till 1955 - We might not even be alive,https://www.reddit.com/r/creepy/comments/4xdzza/why_wait_till_1955_we_might_not_even_be_alive/,creepy,623,notbob1959,167247,26912,1320355957
4t17eq,t3_4t17eq,http://imgur.com/a/ziZBl,5716,0,1468614915,"I always wished they would create a new ""Scary Stories to Tell in the Dark"" book. So I created one myself. Here are a few illustrations from ""Nightmare Soup.""",https://www.reddit.com/r/creepy/comments/4t17eq/i_always_wished_they_would_create_a_new_scary/,creepy,519,madcapmax,9863,1172,1341313678
3gpxz9,t3_3gpxz9,http://i.imgur.com/slf7csU.jpg,5692,0,1439386189,The Eternal Wait,https://www.reddit.com/r/creepy/comments/3gpxz9/the_eternal_wait/,creepy,256,mike_pants,3809609,671694,1352837578
574naf,t3_574naf,https://i.redd.it/isl3fb3va2rx.jpg,5682,0,1476286071,9000 year old stone mask found in the Judean hills in Israel,https://www.reddit.com/r/creepy/comments/574naf/9000_year_old_stone_mask_found_in_the_judean/,creepy,1521,sivribiber,417982,9310,1469036406
48zol9,t3_48zol9,http://i.imgur.com/IQ3wYoh.jpg,5668,0,1457130598,Diver kneels under sunken Russian destroyer,https://www.reddit.com/r/creepy/comments/48zol9/diver_kneels_under_sunken_russian_destroyer/,creepy,322,willhaney,118053,11912,1156786777
3rn6j1,t3_3rn6j1,http://imgur.com/I2n7Gbm,5647,0,1446740321,Noticed this when walking past a river in Copenhagen,https://www.reddit.com/r/creepy/comments/3rn6j1/noticed_this_when_walking_past_a_river_in/,creepy,408,v2thaj,4084,1159,1367588831
4z3gl3,t3_4z3gl3,http://imgur.com/a/8yW8j,5642,0,1471908582,"'Invisible' statues in Scottish forests made from acrylic plexiglass, by Rob Mulholland",https://www.reddit.com/r/creepy/comments/4z3gl3/invisible_statues_in_scottish_forests_made_from/,creepy,475,iBleeedorange,7872294,940346,1253804995
2wrack,t3_2wrack,http://imgur.com/LZ2FF6u,5623,0,1424611432,Just rented a new place. Previous tenant left the wall mirror...and a dirty secret!,https://www.reddit.com/r/creepy/comments/2wrack/just_rented_a_new_place_previous_tenant_left_the/,creepy,1678,scratchamaballs,3821,8053,1408712466
2az112,t3_2az112,http://imgur.com/fvGcpkS,5601,0,1405619420,"A passenger posted this on Facebook right before he boarded Malaysia Airlines MH17. It reads ""If it disappears, this is what it looks like.""",https://www.reddit.com/r/creepy/comments/2az112/a_passenger_posted_this_on_facebook_right_before/,creepy,1073,uncertainness,15013,20354,1263316659
4w2ctg,t3_4w2ctg,https://i.reddituploads.com/fd48f810401940d58609d9b4041a9009?fit=max&h=1536&w=1536&s=c8147cc395da07d23964ae28a4a15f28,5596,0,1470278275,My toddler while I'm trying to use the bathroom,https://www.reddit.com/r/creepy/comments/4w2ctg/my_toddler_while_im_trying_to_use_the_bathroom/,creepy,619,CrazyCanucck,4469,504,1362116345
4v0mah,t3_4v0mah,https://i.reddituploads.com/6f929ce1ed5b4aa9b974e143e86ebb0a?fit=max&h=1536&w=1536&s=fd995d5a17df796fd1871aa8cada8522,5573,0,1469711467,Giant anaconda in the Amazon River (xpost from /r/pics),https://www.reddit.com/r/creepy/comments/4v0mah/giant_anaconda_in_the_amazon_river_xpost_from/,creepy,1204,EyB0ssIHabeACancer,4034,137,1465190307
40e29o,t3_40e29o,http://imgur.com/a/2KsvF,5573,0,1452470951,Had to walk by this in my building at 3AM.,https://www.reddit.com/r/creepy/comments/40e29o/had_to_walk_by_this_in_my_building_at_3am/,creepy,593,greeeeeeeg,5228,1077,1440103965
4wfnhm,t3_4wfnhm,https://i.reddituploads.com/148b917d53a040d081abe22edec1c478?fit=max&h=1536&w=1536&s=e69ffc88eb3b56a35b29afb24c8e29fe,5550,0,1470485530,Hello there. I was expecting you,https://www.reddit.com/r/creepy/comments/4wfnhm/hello_there_i_was_expecting_you/,creepy,440,punksneverdie,4188,55,1443758076
544tik,t3_544tik,https://i.reddituploads.com/9e784d2236404f7ca2874bd9a7ba4453?fit=max&h=1536&w=1536&s=738974f82ead1001ba2676758696f6ed,5511,0,1474639097,If this place isn't haunted that's a goshdarn waste,https://www.reddit.com/r/creepy/comments/544tik/if_this_place_isnt_haunted_thats_a_goshdarn_waste/,creepy,595,LoneliestYeti,4601,151,1464186039
578dqr,t3_578dqr,http://i.imgur.com/OaG0yDJ.jpg,5510,0,1476330799,Sword handle made from human femur,https://www.reddit.com/r/creepy/comments/578dqr/sword_handle_made_from_human_femur/,creepy,789,KevlarYarmulke,3359265,87436,1322109857
2f98le,t3_2f98le,http://i.imgur.com/Ll2VTZS.jpg,5509,0,1409664009,An aid worker sprays the corpse of a man killed by Ebola with disinfectant. Looks like something out of The Stand.,https://www.reddit.com/r/creepy/comments/2f98le/an_aid_worker_sprays_the_corpse_of_a_man_killed/,creepy,418,FullClockworkOddessy,16244,318678,1332593156
51qto4,t3_51qto4,https://i.redd.it/i6w4tx4vgakx.jpg,5485,0,1473334012,corpse of Italian WW1 soldier emerges from the glaciers of Northern Italy as climate heats up,https://www.reddit.com/r/creepy/comments/51qto4/corpse_of_italian_ww1_soldier_emerges_from_the/,creepy,1124,sivribiber,417982,9310,1469036406
4cf9om,t3_4cf9om,http://i.imgur.com/r7tYMCY.jpg,5471,0,1459255750,"A Mongolian Woman Condemned to Die of Starvation, 1913.",https://www.reddit.com/r/creepy/comments/4cf9om/a_mongolian_woman_condemned_to_die_of_starvation/,creepy,1455,ethan_kahn,2397426,70380,1328043893
2yt711,t3_2yt711,http://i.imgur.com/NwkY66D.jpg,5455,0,1426178914,I think my dog needs an exorcist,https://www.reddit.com/r/creepy/comments/2yt711/i_think_my_dog_needs_an_exorcist/,creepy,344,quince6,3697,26,1423443170
4pg3uv,t3_4pg3uv,http://i.imgur.com/5iPMM0d.jpg,5455,0,1466678523,Coraline's Other Mother Cosplay,https://www.reddit.com/r/creepy/comments/4pg3uv/coralines_other_mother_cosplay/,creepy,353,Rihanna000,0,0,0
4xb3ga,t3_4xb3ga,https://i.reddituploads.com/7c1a53b69541444db0e463a67eef73f8?fit=max&h=1536&w=1536&s=23b60f93f069294dde0901aff2d73d30,5414,0,1470965136,"Witch doctor, India",https://www.reddit.com/r/creepy/comments/4xb3ga/witch_doctor_india/,creepy,1063,KermitTheSnail,237093,5025,1470179956
4xw4j7,t3_4xw4j7,http://imgur.com/kGZGZgj,5402,0,1471298881,Caskets are coming out of the ground near baton rouge,https://www.reddit.com/r/creepy/comments/4xw4j7/caskets_are_coming_out_of_the_ground_near_baton/,creepy,1619,BedriddenSam,126226,44700,1410231778
3wbm4l,t3_3wbm4l,http://i.imgur.com/D9f6pkk.jpg,5399,0,1449803908,The Asaro Mudmen of Papua New Guinea have some terrifying masks,https://www.reddit.com/r/creepy/comments/3wbm4l/the_asaro_mudmen_of_papua_new_guinea_have_some/,creepy,517,Iustinus_Maximus,4480,1297,1316031430
4mzhl5,t3_4mzhl5,https://i.reddituploads.com/1528c9ca580548eb9932229faab6a72a?fit=max&h=1536&w=1536&s=8ae681453e5e19c3014ebba25149e0ab,5360,0,1465312123,Here a painting I did for creepy comics :),https://www.reddit.com/r/creepy/comments/4mzhl5/here_a_painting_i_did_for_creepy_comics/,creepy,689,Ryanbrown-art,9980,948,1465125052
2mrpsd,t3_2mrpsd,http://i.imgur.com/Nn9R1nL.jpg,5354,0,1416404911,"My wife heard her name being whispered ""Naa-taa-shaa.."" she looked at the baby monitor to find our son like this.",https://www.reddit.com/r/creepy/comments/2mrpsd/my_wife_heard_her_name_being_whispered_naataashaa/,creepy,1391,scottymac23,4417,3204,1337191629
4k7ygd,t3_4k7ygd,http://i.imgur.com/UmB43lF.jpg,5326,0,1463746674,The inside of a Leatherback Turtle's mouth is the thing nightmares are made of...xpost /r/pics,https://www.reddit.com/r/creepy/comments/4k7ygd/the_inside_of_a_leatherback_turtles_mouth_is_the/,creepy,917,unknown_name,1936815,147682,1300825028
2xlaan,t3_2xlaan,http://i.imgur.com/ru3nYxI.jpg,5321,0,1425240156,"Mushroom called ""devil's fingers"" looks like a hand reaching out of the ground",https://www.reddit.com/r/creepy/comments/2xlaan/mushroom_called_devils_fingers_looks_like_a_hand/,creepy,199,mike_pants,3809610,671694,1352837578
2zz6pq,t3_2zz6pq,http://i.imgur.com/nCAhPQq.jpg,5321,0,1427082593,Took a picture of the 4th street bridge. Had no idea my friend and I were being watched for the 20 minutes we were under the bridge (X-Post /r/ITAP),https://www.reddit.com/r/creepy/comments/2zz6pq/took_a_picture_of_the_4th_street_bridge_had_no/,creepy,672,youeatMYboogers,3743,355,1321066608
41ltks,t3_41ltks,http://i.imgur.com/hWGyIOq.jpg,5308,0,1453161380,The jacana carrying its babies,https://www.reddit.com/r/creepy/comments/41ltks/the_jacana_carrying_its_babies/,creepy,284,mike_pants,3809610,671694,1352837578
2kapsu,t3_2kapsu,http://imgur.com/a/6Qbo4,5297,0,1414256035,Top 10 All-Time submissions for /r/ImaginaryHorrors.,https://www.reddit.com/r/creepy/comments/2kapsu/top_10_alltime_submissions_for_rimaginaryhorrors/,creepy,420,ethan_kahn,2397426,70380,1328043893
4wvnld,t3_4wvnld,https://i.redd.it/brsjgetfbcex.jpg,5291,0,1470741297,"Executioner's mask, Tower of London",https://www.reddit.com/r/creepy/comments/4wvnld/executioners_mask_tower_of_london/,creepy,577,sivribiber,417983,9310,1469036406
3h6xex,t3_3h6xex,https://i.imgur.com/9Gom2GA.jpg,5260,0,1439725666,This was once a home. Maybe it still is.,https://www.reddit.com/r/creepy/comments/3h6xex/this_was_once_a_home_maybe_it_still_is/,creepy,314,rustybricks,42857,6429,1366715150
504qsd,t3_504qsd,https://i.imgur.com/jBRnlgd.jpg,5249,0,1472473505,Relaxing by the river.,https://www.reddit.com/r/creepy/comments/504qsd/relaxing_by_the_river/,creepy,881,FleeCircus,5425,35686,1338423675
54zbbd,t3_54zbbd,http://i.imgur.com/WQfkm8K.jpg,5242,0,1475105262,Scarecrow at the far end of the field,https://www.reddit.com/r/creepy/comments/54zbbd/scarecrow_at_the_far_end_of_the_field/,creepy,604,Smartstocks,78858,87094,1416753773
4ckqvm,t3_4ckqvm,http://i.imgur.com/qwvMNaK.jpg,5228,0,1459344460,Reflections,https://www.reddit.com/r/creepy/comments/4ckqvm/reflections/,creepy,1020,happybubby,5639,6516,1433143038
3h3cgg,t3_3h3cgg,http://imgur.com/D9Nc2sh,5224,0,1439644257,Danish Special Forces,https://www.reddit.com/r/creepy/comments/3h3cgg/danish_special_forces/,creepy,1044,TheAntiBurrito,8868,858,1430185007
3ov4ma,t3_3ov4ma,http://i.imgur.com/RHo3zV0.jpg,5223,0,1444921310,I took this long exposure shot of a pumpkin as my lense unknowingly fogged up,https://www.reddit.com/r/creepy/comments/3ov4ma/i_took_this_long_exposure_shot_of_a_pumpkin_as_my/,creepy,318,kudjo24,5091,142,1443462243
3pdslf,t3_3pdslf,http://imgur.com/TjTk3SF,5208,0,1445278516,I live on the second story and a painter made me almost crap my pants when i woke up this morning,https://www.reddit.com/r/creepy/comments/3pdslf/i_live_on_the_second_story_and_a_painter_made_me/,creepy,292,DJ-spetznasty,3973,88,1432364358
3pm7s0,t3_3pm7s0,http://imgur.com/wyXTzLD,5203,0,1445423659,Early diving equipment,https://www.reddit.com/r/creepy/comments/3pm7s0/early_diving_equipment/,creepy,564,derfapart,10258,90,1384017273
57ucxk,t3_57ucxk,https://i.redd.it/56rpbjo0bxrx.jpg,5170,0,1476661431,skull of a horse with cyclopia from 1841,https://www.reddit.com/r/creepy/comments/57ucxk/skull_of_a_horse_with_cyclopia_from_1841/,creepy,857,KermitTheSnail,237099,5025,1470179956
4ub7bf,t3_4ub7bf,http://imgur.com/a/9XNDB,5162,0,1469325350,Angels by Peter Mohrbacher,https://www.reddit.com/r/creepy/comments/4ub7bf/angels_by_peter_mohrbacher/,creepy,525,iBleeedorange,7872294,940346,1253804995
536ooj,t3_536ooj,https://i.redd.it/m6lah7wjc2mx.jpg,5161,0,1474107406,Mauled by Big Bad Wolf (toilet paper/fake blood),https://www.reddit.com/r/creepy/comments/536ooj/mauled_by_big_bad_wolf_toilet_paperfake_blood/,creepy,242,Terminator_Ecks,4368,1056,1473686671
57jmcu,t3_57jmcu,http://i.imgur.com/GEdmN64.jpg,5157,0,1476490806,Happy Happy Joy Joy!!!,https://www.reddit.com/r/creepy/comments/57jmcu/happy_happy_joy_joy/,creepy,367,IAMAHearMeRoar,4986,6494,1338834130
3d6q7i,t3_3d6q7i,http://imgur.com/ii7KMNJ,5153,0,1436829669,A house I pass on the way to work has this sculpture in its yard. Its about 8 feet tall.,https://www.reddit.com/r/creepy/comments/3d6q7i/a_house_i_pass_on_the_way_to_work_has_this/,creepy,654,elementalmw,5041,23253,1337194411
52o9sq,t3_52o9sq,https://i.reddituploads.com/2f495aafe74c430dbaba82b027c91f2c?fit=max&h=1536&w=1536&s=5685f3a61613647e408c59cba10a457b,5135,0,1473818453,Taken recently on a country road in the Appalachian Mountains of West Virginia near Bluefield.,https://www.reddit.com/r/creepy/comments/52o9sq/taken_recently_on_a_country_road_in_the/,creepy,1748,AgalychnisCallidryas,5142,1147,1415065125
46fars,t3_46fars,http://i.imgur.com/7GnDeYk.jpg,5112,0,1455809905,Plague doctors,https://www.reddit.com/r/creepy/comments/46fars/plague_doctors/,creepy,619,wooly_mastodon,115972,2740,1453258616
3399ps,t3_3399ps,https://i.imgur.com/AnRRcUa.jpg,5112,0,1429552126,"I find this statue of Shiva, nearly submerged in Indian floodwater, somehow very unsettling",https://www.reddit.com/r/creepy/comments/3399ps/i_find_this_statue_of_shiva_nearly_submerged_in/,creepy,746,N/A,0,0,0
50miol,t3_50miol,https://i.redd.it/72pqs9xi7wix.jpg,5097,0,1472725552,"Underwater memorial to Jesuit missionaries who were travelling from Portugal to Brazil in 1570, dismembered and murdered by pirates before being thrown overboard.",https://www.reddit.com/r/creepy/comments/50miol/underwater_memorial_to_jesuit_missionaries_who/,creepy,515,sivribiber,417983,9310,1469036406
4t942u,t3_4t942u,http://img02.deviantart.net/f0b3/i/2016/199/4/0/noonwraith_the_witcher_3_cosplay_by_elenasamko-daaezti.jpg,5087,0,1468751017,Noonwraith The Witcher 3 Cosplay,https://www.reddit.com/r/creepy/comments/4t942u/noonwraith_the_witcher_3_cosplay/,creepy,269,austinzzz,35999,6342,1378602897
3u00cq,t3_3u00cq,http://imgur.com/kbNlUDd,5083,0,1448317483,Found in my younger sister's notebook,https://www.reddit.com/r/creepy/comments/3u00cq/found_in_my_younger_sisters_notebook/,creepy,643,erincmcf,3758,236,1392470587
2zf2i6,t3_2zf2i6,http://i.imgur.com/cyQ5s7W.jpg,5059,0,1426640961,Exploring an underwater sea cave when suddenly...,https://www.reddit.com/r/creepy/comments/2zf2i6/exploring_an_underwater_sea_cave_when_suddenly/,creepy,706,unknown_name,1936815,147682,1300825028
3m2ava,t3_3m2ava,http://i.imgur.com/byhDkLx.jpg,5041,0,1443014841,Message from a Dead Scientist,https://www.reddit.com/r/creepy/comments/3m2ava/message_from_a_dead_scientist/,creepy,681,rannie_pophe,195281,61553,1346728222
4x1yvg,t3_4x1yvg,https://i.redd.it/gupqlz2wxjex.jpg,5039,0,1470833595,1715 diving suit,https://www.reddit.com/r/creepy/comments/4x1yvg/1715_diving_suit/,creepy,555,KermitTheSnail,237100,5025,1470179956
4c21zo,t3_4c21zo,http://imgur.com/PGo3AVl,5039,0,1459013760,Nerves.,https://www.reddit.com/r/creepy/comments/4c21zo/nerves/,creepy,881,encryptyourmind,4008,110,1447779039
56gmx2,t3_56gmx2,https://i.redd.it/vgnvn9i7p8qx.jpg,5036,0,1475927693,"abandoned Beelitz military hospital, Germany. Hitler was treated there.",https://www.reddit.com/r/creepy/comments/56gmx2/abandoned_beelitz_military_hospital_germany/,creepy,215,KermitTheSnail,237100,5025,1470179956
4ikrys,t3_4ikrys,http://i.imgur.com/KhSC4U5.jpg,5036,0,1462816556,Bodies from Pompeii.,https://www.reddit.com/r/creepy/comments/4ikrys/bodies_from_pompeii/,creepy,710,AbortionGhost,173455,1771,1460392955
48m4qk,t3_48m4qk,https://i.imgur.com/4sFcd7B.jpg,5035,0,1456925474,P.T (Silent Hill) inspired costume.,https://www.reddit.com/r/creepy/comments/48m4qk/pt_silent_hill_inspired_costume/,creepy,352,fingercup,637688,44321,1455256462
2l5920,t3_2l5920,http://i.imgur.com/MAUmRQn.jpg,5034,0,1415007673,I've been told this belongs here - a photo I took at a fireworks display looks eerily like the beginning of an alien abduction.,https://www.reddit.com/r/creepy/comments/2l5920/ive_been_told_this_belongs_here_a_photo_i_took_at/,creepy,161,Crazyturn,4841,25,1318438526
34am5a,t3_34am5a,http://imgur.com/54W2aDq,5033,0,1430326740,Just a chair sitting at the bottom of the ocean,https://www.reddit.com/r/creepy/comments/34am5a/just_a_chair_sitting_at_the_bottom_of_the_ocean/,creepy,569,surfskatevape,4671,1938,1412136507
2tnbtg,t3_2tnbtg,http://i.imgur.com/vJk2zND.jpg,5027,0,1422218841,Under water shit weirds me out,https://www.reddit.com/r/creepy/comments/2tnbtg/under_water_shit_weirds_me_out/,creepy,873,poopyflavouredlolly,28036,25841,1353106201
56ti1x,t3_56ti1x,http://i.imgur.com/61cCwAm.jpg,5024,0,1476124084,The Sarcastic Fringehead,https://www.reddit.com/r/creepy/comments/56ti1x/the_sarcastic_fringehead/,creepy,455,Apostjustforthis,237729,14891,1441143697
539q2p,t3_539q2p,https://i.reddituploads.com/ed97dbea20ed494a8364220a28714deb?fit=max&h=1536&w=1536&s=c4d6384481371022053135a523f38cc9,5021,0,1474154862,World War I Splatter Mask for Tank Crews,https://www.reddit.com/r/creepy/comments/539q2p/world_war_i_splatter_mask_for_tank_crews/,creepy,769,Capnlanky,5233,419,1466699701
4b3s77,t3_4b3s77,http://imgur.com/TPimbee,5015,0,1458406075,My girlfriends mother found this in a field while she was out for a walk in the Czech Republic. Scarecrow perhaps? This thing gave me shivers...,https://www.reddit.com/r/creepy/comments/4b3s77/my_girlfriends_mother_found_this_in_a_field_while/,creepy,695,_BLACK_BY_NAME_,3691,9505,1411402752
4q9wvt,t3_4q9wvt,http://i.imgur.com/JrTHpPL.jpg,5015,0,1467126761,Blood vessels of the head,https://www.reddit.com/r/creepy/comments/4q9wvt/blood_vessels_of_the_head/,creepy,489,KevlarYarmulke,3359309,87436,1322109857
4mc31o,t3_4mc31o,http://i.imgur.com/5i3eShr.jpg,4999,0,1464945753,Cosplay,https://www.reddit.com/r/creepy/comments/4mc31o/cosplay/,creepy,412,Apostjustforthis,237729,14891,1441143697
4wnh6g,t3_4wnh6g,http://i.imgur.com/rJfzdPA.jpg,4991,0,1470614630,From the Guillermo del Toro collection,https://www.reddit.com/r/creepy/comments/4wnh6g/from_the_guillermo_del_toro_collection/,creepy,247,ohsureyoudo,161352,9335,1393304861
